URL,Name,Price,Rating,Review,Description,ASIN,Manufacturer
https://www.amazon.in/ADISA-Laptop-Backpack-Office-College/dp/B0BPTV3795/ref=sr_1_32?keywords=bags&qid=1677081164&sr=8-32,ADISA 35L Large Laptop Backpack Office Bag College Travel Back Pack with rain Cover (Black),₹599.00,9,NA,Material: Water Resistant Strong Polyester   Compartments: 2 with padding   Laptop Size: 15.6 inch and below   Dimensions: LxWxH - 11 x 6 x 18 inches   Reflector Logo / Adjustable Padded Shoulder Straps / 2 Bottle holders / Padded Top Handle / Rain Cover,B0BPTV3795,"ADISA, ADISA INTERNATIONAL, 42/34, Upper Ground Floor, DLF Industrial Area, Kirti Nagar, New Delhi 110015, careadisa@gmail.com"
https://www.amazon.in/Nivia-6853-Polyester-Basic-Duffle/dp/B07FWQ9HRV/ref=sr_1_33?keywords=bags&qid=1677081164&sr=8-33,NIVIA Basic Duffle Polyester Bag/Gym Bags/Adjustable Shoulder Bag for Men/Duffle Gym Bags for Men/Fitness Bag/Carry Bags/Sports & Travel Bag/Sports Kit/Duffle Bags Travel,₹239.00,"2,201",NA,"Strong stitching at major stress points provide long-lasting durability against daily activities   Mesh side water bottle pocket. Adjustable shoulder strap.   Main large compartment with double zip closure. Tough high durability fabric   High quality double zippers, easy to access. Highly water-resistant finish to save inner items from water splashes   Comes in attractive color combinations.",B07FWQ9HRV,Freewill Sports Private Limited
https://www.amazon.in/Bagneeds-Synthetic-Leather-Briefcase-Messenger/dp/B0855F8174/ref=sr_1_34?keywords=bags&qid=1677081164&sr=8-34,Bagneeds Men's Black Synthetic Leather Briefcase Best Laptop Messenger Bag Satchel for Men,₹664.00,"3,687",3,"Suitable for a short business trip or a quick weekend getaway. Size In inches?17""L*4.5""W*12.4""H. weight: 800grm   Laptop padding? The laptop padding fits 15.6 inch laptop for business travel. Other compartment fits 17inch Laptop. Large capacity and front and interior pockets organization for all your business needs.   Removable, adjustable padded shoulder strap   HIGH QUALITY MATERIAL: Made from Premium and Rich quality PU Leather Fabric with Durable Polyester lining.   PERFECT GIFT :With a mutlipurpose use and a classy distressed Vintage inspired look which never goes out of style , This bag is a great gift idea for Fathers Day , Birthdays , Valentines Day , Christmas, Graduation, Back To College Or Any Occasion Which Calls For A Gift . Makes a great gift for professionals, artists , students and all sorts of officials. The bag can be used as a Leather messenger bag for men and women ,laptop bags briefcase , college bag, meeting bag, gift idea",B0855F8174,Bagneeds
https://www.amazon.in/POLESTAR-Vintage-Laptop-Backpack-bagpack/dp/B081GSQ9D9/ref=sr_1_35?keywords=bags&qid=1677081164&sr=8-35,"POLESTAR Vintage 15.6 inch 32 LTR Casual Laptop Backpack/Office Bag/School Bag/College Bag/Business Bag/Unisex Backpack , Water Resistant and Light Weight, 1 year Warranty",₹549.00,"8,423",75,"Care Instructions: Wipe with Damp Cloth   PADDED LAPTOP COMPARTMENT WITH MAXED OUT STORAGE : Generous 32 Ltrs backpack with Dimension of 32 Cm x 22 Cm x 45 Cm, 2 full size compartments, 1 front zipper & 2 side pockets, Fits upto 15.6 inches Laptop with elasticated strap lock at just 590 grams.   CRAFTED WITH PRECISION : Made with strong, water resistant Polyester fabric and faux leather for a lightweight and durable finish. Our polestar Vintage backpack is a blend of style and utility. A classic design with opulent detailing and vegan leather material adds to your style and keeps your belongings safe.   COMFORTABLE CARRY : This strong and impervious backpack is a fabulous choice for daily use. Guaranteed for strength and durability, it has padded breathable mesh back and adjustable straps. The interiors have added foam padding to protected electronics. Ergo-Grip Backstraps that distribute weight evenly over your shoulders and back, while the integrated top grab handle lets you move effortlessly.   BENEFITS: 2 main compartments provide optimal organisation, with premium zippers keeping your valuables protected, two side water bottle pockets help keep your goods dry and body hydrated.   VERSATILITY : This made in india versatile backpack comes with 12 months warranty, and is perfect for everyone, men, women, students, boys & girls, can be used as school, college, office or day travelling backpacks. All in one VINTAGE BACKPACK by Polestar.",B081GSQ9D9,"POLESTAR, JAI AMBAY ENTERPRISES ,03AAFFJ0421M1ZQ, B -29 ,Sports & Surgical complex,Kapurthala Road, Jalandhar Punjab 140021 India . +91 9914112308 , polestarbags@gmail.com"
https://www.amazon.in/ADISA-BP005-Weight-Casual-Backpack/dp/B07F3X45WZ/ref=sr_1_36?keywords=bags&qid=1677081164&sr=8-36,ADISA Light Weight Laptop Backpack 32 Ltrs,₹499.00,"5,578",98,"Adjustable Shoulder Handles / Two Bottle holders / Padded Handle / Reflector Logo   Dimensions : LxWxH- 31 x 18 x 47 cms   Laptop : 15.6 inches and below (Bigger than 15.6 not recommended)   No. of Compartments : 3 with full padding   NOT INCLUDED : NO RAIN COVER, Laptop, Headphones & Cable (Images only for display)",B07F3X45WZ,"ADISA, ADISA INTERNATIONAL, 42/34, Upper Ground Floor, DLF Industrial Area, Kirti Nagar, New Delhi 110015, careadisa@gmail.com"
https://www.amazon.in/sspa/click?ie=UTF8&spc=MToyOTUwNzI4NzM1NDg4NzU0OjE2NzcwODExNjQ6c3BfYnRmOjIwMDIxNDI3OTc2NTA2OjowOjo&url=%2FKiller-Backpack-Compartments-Polyester-Waterproof%2Fdp%2FB07CDD6YS2%2Fref%3Dsr_1_37_sspa%3Fkeywords%3Dbags%26qid%3D1677081164%26sr%3D8-37-spons%26sp_csd%3Dd2lkZ2V0TmFtZT1zcF9idGY%26psc%3D1,KILLER Louis 38L Large Laptop Backpack With 3 Compartments Polyester Trendy Waterproof Travel Backpack,"₹1,566.00","11,056",228,"Care Instructions: Hand Wash Only   3 Large Compartments, 1 Easy access front Pocket with organizer section & 2 mesh side pocket   Outer Fabric: Durable PU coated Polyester Fabric, inner abric: Strong PU coated polyester fabtic, Hip Strap : No   Well cushioned Laptop compartment for upto 15.6 inch Laptop and spacious enough to carry for two days cloths   Weight: 800gm; Dimensions: 13.00x18.75x9.50 inches (WxHxD)   Strap Type: Adjustable; Pattern Name: Solid; Closure Type: Zipper; Warranty Description: 1 Year Warranty Against Manufacturing Defects.; Pocket Description: Utility Pocket; Style Name: Casual; Compartment Description: Up To 15 Inches; Water Resistance Level: Waterproof; Age Range Description: Adult",B07CDD6YS2,"Ambrosia Bags, B-42, 2nd Floor, Ajay Mittal Industrial Estate Andheri Kurla Road, Marol, Andheri (E) Mumbai, Maharashtra, India – 400059 Mobile: +91 8767008844"
https://www.amazon.in/sspa/click?ie=UTF8&spc=MToyOTUwNzI4NzM1NDg4NzU0OjE2NzcwODExNjQ6c3BfYnRmOjIwMDMxMzA3NTc1OTk4OjowOjo&url=%2FHEROZ-Hammer-Durable-Travel-Laptop%2Fdp%2FB07MGDFT9C%2Fref%3Dsr_1_38_sspa%3Fkeywords%3Dbags%26qid%3D1677081164%26sr%3D8-38-spons%26sp_csd%3Dd2lkZ2V0TmFtZT1zcF9idGY%26psc%3D1%26smid%3DAGHKR430JFM4U,HEROZ Hammer Unisex Nylon 45 L Travel Laptop Backpack Water Resistant Slim Durable Fits Up to 17.3 Inch Laptop Notebook (All) (Grey & Black),"₹1,274.00","7,674",179,"Warranty type: Manufacturer, 1 year domestic warranty    Special Features: Laptop Compartment; Pocket Description: Utility Pocket; Age Range Description: Adult; Closure Type: Zipper Snap; Pattern Name: Solid; Warranty Description: 1. Year Manufacturer Warranty; Strap Type: Chain; Compartment Description: Greater Than 17 Inches",B07MGDFT9C,Heroz
https://www.amazon.in/sspa/click?ie=UTF8&spc=MTo0Nzg1Mjc5NjA3NjcwNjYyOjE2NzcwODEzNDc6c3BfYXRmX25leHQ6MjAxMTUxMDQ5MDc4OTg6OjA6Og&url=%2FMokobara-Transit-Backpack-Laptop-Sunray%2Fdp%2FB09V7R98XC%2Fref%3Dsr_1_33_sspa%3Fkeywords%3Dbags%26qid%3D1677081347%26sr%3D8-33-spons%26sp_csd%3Dd2lkZ2V0TmFtZT1zcF9hdGZfbmV4dA%26psc%3D1,MOKOBARA The Transit Backpack Laptop Bag for Men and Women,"₹5,499",418,39,"Care Instructions: Wipe with Damp Cloth   CRAFTED WITH INDUSTRY BEST PREMIUM MATERIALS: Materials: Vegan leather and nylon fabric, Casing: Soft, Colour: Light Brown, Water resistant: Yes   MOST FEATURE RICH BACKPACK: Front bucket pocket: Retractable key holder, Card holder, Slip pockets, Zippered pocket, Flat opening tech compartment: 5 pockets to store all your tech accessories, Padded laptop compartment with lock strap, Fits up to a 16” laptop   INDUSTRY BEST FUNCTIONAL BACKPACK: 2 Hidden bottle/umbrella pocket, Hidden magnetic passport pocket, 10 thoughtfully designed pockets, Luggage sleeve, Silicon grab handle, Padded shoulder straps, Easy length adjustment buckles   MAXED OUT STORAGE: Dimension: 48 x 31 x 16 cm, Capacity: 24L   MORE REASONS TO LOVE YOUR MOKOBARA: Warranty type: 12 Months, Register warranty on (mokobara.com/warranty), get in touch with us @7975298840 (10:30AM - 5:30PM MON-FRI)",B09V7R98XC,"Designed By Mokobara Lifestyle Private Limited, Bangalore., Designed By Mokobara"
https://www.amazon.in/sspa/click?ie=UTF8&spc=MTo0Nzg1Mjc5NjA3NjcwNjYyOjE2NzcwODEzNDc6c3BfYXRmX25leHQ6MjAxMTUxMDQ5MDgxOTg6OjA6Og&url=%2FMOKOBARA-TSBPK12CND22001-Backpack-Happy-Green%2Fdp%2FB08SW9W2FY%2Fref%3Dsr_1_34_sspa%3Fkeywords%3Dbags%26qid%3D1677081347%26sr%3D8-34-spons%26sp_csd%3Dd2lkZ2V0TmFtZT1zcF9hdGZfbmV4dA%26psc%3D1,"MOKOBARA Backpack 15.5"" Inch Laptop Backpack For Women (16 litres ) Improved (2022 - Model)","₹4,499.00",149,5,"CRAFTED WITH INDUSTRY BEST PREMIUM MATERIALS: Materials: Vegan leather and nylon fabric, Casing: Soft, Colour: Green, Water resistant: Yes.    PADDED LAPTOP COMPARTMENT AND MAXED OUT STORAGE: Dimension: 29 x 14 x 41 cm, Capacity: 16L, Fits up to a 15.4” laptop    MOST FEATURE RICH BACKPACK: Vegan leather trims, Padded shoulder straps, Easy length adjustment buckle & strap lock, Hidden expandable side water bottle pocket, Luggage sleeve    HIDDEN MAGNETIC POCKET: Snaps close and stores your phone/passport for quick access; MORE REASONS TO LOVE YOUR MOKOBARA: Warranty type: 12 Months, Register warranty on (mokobara.com/warranty), get in touch with us @7975298840 (10:30AM - 5:30PM MON-FRI)    Warranty Description: 12 Months Warranty; Color Name: Happy Green; Closure Type: Zipper; Age Range Description: Adult; Lining Description: Polyester; Compartment Description: Up To 16 Inches; Pattern Name: Solid",B08SW9W2FY,"Designed By Mokobara Lifestyle Private Limited, Mokobara Lifestyle Private Limited, Bangalore. Customer Care: Email : hello@mokobara.com Contact no. 7975298840 (10:30AM - 5:30PM MON-FRI)"
https://www.amazon.in/Half-Moon-Backpack-Luggage-Compartment/dp/B09VCLZ3K4/ref=sr_1_35?keywords=bags&qid=1677081347&sr=8-35,Half Moon Large 37L Laptop Bag Backpack for menं Women Boys and Girls Luggage Travel Bags with 17.3 inches Laptop Compartment & Rain Cover,₹999.00,"2,204",17,"SPACIOUS AND LIGHTWEIGHT: Light weight and spacious laptop backpack with 3 compartments. One compartment is for carrying laptop inside (Upto 17 inches), with padding for safety, and space for laptop accessories like charger, etc. Second large compartment for books, files and all your day to day essentials. And third compartment is for your extra stuff. It has provision for holding bottles on both sides and has padded shoulder straps for your comfort    COMFORT WITH QUALITY: This Backpack has Wide, Padded and Adjustable shoulder straps and Padded Back for comfort in carrying heavy items. Stitched properly and Bartacks on every pressure point for extra durability. Made with strong yet light weight polyester fabric with heavy zippers. It also comes with a Rain cover so that you can travel during rainy season without any problem. This backpack be used by everyone be it men? , women? , boys , girls.    SMART & TRENDY LOOKS: This Large rucksack bag is smart, trendy and stylish in looks. The multipurpose rucksack bacpack looks smart, athletic and venturesome and the blend of grey and red makes it appear exquisite. Your hiking trips, mountaineering experience cannot get completed without this amazing trekking backpack.    ENDURING & LONG LASTING: This trekking backpack bag is made up of highly durable material, which makes it suitable for all weather conditions including heavy rains and extreme scorching heat. It will not only keep the inside stuff safe but will also resist damage to itself.;Style Name: Casual; Pocket Description: Utility Pocket; Compartment Description: Up To 17 Inches; Age Range Description: Adult;Pattern Name: Solid    OTHER FEATURES: Rain Cover, 17 inch Laptop compartment, Internal Organiser(Small Pockets), Strong and durable zippers, Adjustable Shoulder Handles (Straps) , 2 Bottle/Umbrella holders , Padded Handle , Padded Laptop Compartment , Ergonomic Design, Reflector Logo, etc",B09VCLZ3K4,Amazing Bags
https://www.amazon.in/Step-Backpack-Small-Water-Repellant/dp/B088XH1BP7/ref=sr_1_36?keywords=bags&qid=1677081347&sr=8-36,"Mi Step Out 12 L Mini Backpack (Small Size, Dark Blue, Water Repellant)",₹299.00,"7,838",73,"Made of multi-coated 600D polyester Material ; Water Repellent   Dimension: 38cm x 26cm x 14cm (LxWxH); Weight : 200 grams; Capacity: 12liters   Small Size backpack; Laptop Compatibility: No   This backpack comes with 2 zipper pockets that can house a notebook, gym gear, travel essentials and more   With contra zippers and adjustable straps this light weight backpack is the ideal companion while at the airport or hitting the gym or exploring new city or using it as a carrier for books   6 months limited warranty",B088XH1BP7,Korrun India Pvt. Ltd
https://www.amazon.in/Nivia-6853-Polyester-Basic-Duffle/dp/B07FWQ9HRV/ref=sr_1_37?keywords=bags&qid=1677081347&sr=8-37,NIVIA Basic Duffle Polyester Bag/Gym Bags/Adjustable Shoulder Bag for Men/Duffle Gym Bags for Men/Fitness Bag/Carry Bags/Sports & Travel Bag/Sports Kit/Duffle Bags Travel,₹239.00,"2,201",NA,"Strong stitching at major stress points provide long-lasting durability against daily activities   Mesh side water bottle pocket. Adjustable shoulder strap.   Main large compartment with double zip closure. Tough high durability fabric   High quality double zippers, easy to access. Highly water-resistant finish to save inner items from water splashes   Comes in attractive color combinations.",B07FWQ9HRV,Freewill Sports Private Limited
https://www.amazon.in/Inovera-Label-Women-Handbags-Shoulder/dp/B08CMQD4BC/ref=sr_1_38?keywords=bags&qid=1677081347&sr=8-38,"INOVERA Faux Leather Women Handbags Shoulder Hobo Bag Purse With Long Strap, 32L x 13B x 30H cm","₹1,399.00","6,931",3,"Medium Purses for Women: 32L x 13B x 30H cm. Short handle height: 25cm, This hobo bag comes with a long removable and adjustable shoulder strap, which can be used as a women shoulder bag or hobo cross-body bag.   Updated Women Handbags: High-quality Vegan leather, Reinforced shoulder strap and improved zipper quality, also improved lining polyester, all faux leather hobo bags have been done anti-shock&wear-resistant tests, good purses and handbags for women.   Package Include: 1 x Hand Bag, 1 x Cross Body Strap   Structure: Ladies hobo handbags has one main compartment,1 middle compartment, 1 zipper pocket and 2 slot pockets, with 1 back zipper pocket, enough capacity to organize your daily items, such as 9.7-inch iPad, book, umbrella, wallet, water bottle, iPhone and cosmetics, etc.   Classic Hobo Purse: Top zipper closure, with 2 side zipper pockets design and elegant tassels decoration, fashionable and practical handbags for women, perfect for shopping, dating, travel and business.   🚩 DISCLAIMER: 🚩 WE HIGHLY RECOMMEND TO CHECK THE PRODUCT SIZE CHART IN 2ND IMAGE BEFORE PURCHASE TO AVOID MISCONCEPTION REGARDING THE PRODUCT SIZE. PRODUCT COLOUR MAY SLIGHTLY VARY DUE TO PHOTOGRAPHIC LIGHTING SOURCES OR YOUR MONITOR SETTINGS.",B08CMQD4BC,Panda Exim
https://www.amazon.in/Genie-Clara-Backpack-Women-compartments/dp/B097JJGR1N/ref=sr_1_39?keywords=bags&qid=1677081347&sr=8-39,"Genie Clara Backpack for Women - 3 compartments, Laptop Bags for Girls, Stylish and Trendy College Backpacks for Girls, Water Resistant and Lightweight Bags for Office and Travelling Purpose.",₹729,39,3,"Made with High Quality fabric. Outer material: Nylon Twill - Soft, Durable and Water Resistant. Capacity: 36 liters, Dimensions: 48 x 33 x 23 cm Warranty: 12 months   3 Spacious compartment: Store your Books, Stationary, Accessories, Lunch boxes, etc. It will store plenty of items. Laptop Sleeve: Ensure that your laptop is stored separately and Securely! Organizer: Keep every single item separately in an arranged manner, with the help of our organizer. 2 side pocket: For holding water bottle, clipping pens or pencil or storing other items. 1 Front Pocket: Easily accessible. To keep all your essentials such as wallet, ticket, cosmetics.   Easy grab padded handle: For added comfort and convinience to hold the bag. Padded and Ergonomic Shoulder Straps: There is padded back mesh and ergonomic straps that gives extra spine and shoulder support and helps in minimizing the load after carrying the bag through a busy day at campus.This women's backpack can be carried to work, college, school, for a day out or even while you are travelling!   Light Weight yet Durable to resist the weight of textbooks, stationary, lunch boxes. Can store all your college or office stationary, without any hassle.   Stylish & Cute: This bag is designed for those Millennials and GenZ, who aren't afraid to compromise on Utility or Fashion! It is a perfect, small bag to carry all the daily essentials while using it as a trendy accessory, or a travel bag or as a college backpack.",B097JJGR1N,"Safari, 302-303, A Wing, The Qube CTS No.1498, A/2, Sir Mathuradas Vasanji Rd, Marol, Andheri East, Mumbai, Maharashtra 400059"
https://www.amazon.in/Casual-Backpack-Charging-Laptop-Compartment/dp/B07J46KLFP/ref=sr_1_40?keywords=bags&qid=1677081347&sr=8-40,"Fur Jaden 15.6 Inch Laptop Backpack 25 LTR Bag for School, College and Office with USB Charging Port",₹489.00,"9,866",391,"Grey Colour Backpack for Men for Stylish Office use as well as for Trendy College and School students. Huge compartment size that can fit upto a 15.6 inch Laptop with ease. Multiple pockets for other accessories and water bottle   Capacity: 25 liters; Weight: 500 grams; Dimensions: 30 cms x 20 cms x 42 cms (LxWxH)   The backpack features a sleek and ergonomic design with a balanced weight distribution through its straps. This makes this product a suitable alternative to bulky and unsightly backpacks. The compact design of this backpack helps you to rest it comfortably on your shoulders while accommodating all your essentials with ease.   USB Charging Point to Charge On the Go - With our attached charging dock, now charing on the go is easier than before. Important Note: We do not provide Free Portable Charger with the Bag   Warranty- 10 days No Question asked replacement guarantee from the date of delivery. 6 Month Manufacturer and Seller Warranty",B07J46KLFP,"Fur Jaden, Fur Jaden 3-C, Jai Hind Bld, Dr AM Road, Bhuleshwar, Mumbai 400002, 8080888028"
https://www.amazon.in/FUR-JADEN-Backpack-Accessories-Organiser/dp/B0BSHBH9K2/ref=sr_1_41?keywords=bags&qid=1677081347&sr=8-41,"FUR JADEN 15.6 Inch Smart Laptop Backpack Bag With USB Charging Port, Anti Theft Pocket and Accessories Organiser for Men Women Boys Girls",₹999.00,136,NA,"Care Instructions: Wipe with Damp Cloth   Essence: This Fur Jaden smart laptop backpack is for Men and Women who are looking for a voguish, modernistic and branded backpack while having the option to not compromise on quality and be able to carry tons of stuff. Easy Access Pockets: A sleek anti theft pocket on the back as well as 2 pockets on the front side help keep all your belongings comfortably organised.   Multi Functional: This Fur Jaden Smart Backpack for men and women comes with a USB Charging Port which offers a convenient way to ensure you never run out of battery on the go. Organizer Pockets in the front compartment help keep al your accessories organized. Padded Laptop compartment helps keep your laptop safe.   Ergonomic Design: The backpack features a sleek and ergonomic design with a balanced weight distribution through its straps to reduce the load bearing on your shoulders while the padded ventilated air mesh helps reduce sweat. This makes this bagpack a suitable alternative to bulky and unsightly laptop backpacks. The compact design of this Fur Jaden smart travel bag helps you to rest it comfortably on your shoulders while accommodating all your essentials with ease.   Dimensions: 48 CM (H) x 30CM (W) x 15CM (D). Weight: 450 Grams. Volume: 22L   Warranty: 1 Year Manufacturer Warranty Against Manufacturing Defects.",B0BSHBH9K2,"Fur Jaden, Fur Jaden, 3C Jai Hind Bld, Dr AM Road, Bhuleshwar, Mumbai 400002"
https://www.amazon.in/AirCase-C30-Messenger-Compartments-Multi-Pockets/dp/B07V47HHRG/ref=sr_1_42?keywords=bags&qid=1677081347&sr=8-42,"AirCase Office Sling Messenger Bag fits upto 15.6"" Laptop/Macbook, Detachable Shoulder Strap, Waterproof, Shockproof, Spacious Pockets for Office/Travel, Black- With Warranty","₹1,451.00","1,241",23,"INNOVATIVE DESIGN: Utility of a Messenger Bag with Convenience of a Laptop Sleeve. Built with Premium Waterproof Nylon with Impact Resistant Foam Cushion & Soft lining which prevents scratches.   CONVENIENT & COMFORTABLE: 1 Main compartment with attached Laptop Sleeve. 2 Front Zipper Pockets to organize accessories such as Charger, Power bank, Phone, Tablet, cable, Pen, Notebook, etc.   KEEPS YOUR BELONGINGS SAFE: This Hand Bag is made of Soft and Environmental Friendly Material with Reinforced Edges. Soft Padding of the Main Compartment offers Protection to your laptop.   TRAVEL FRIENDLY: It Comes with Adjustable & Removable Shoulder Strap for easy Portability. It can be carried as a Briefcase or carried as a Sling Bag as per convenience. It also comes with a Trolley Strap which makes it perfect for Business Travel.   WIDELY COMPATIBLE : Made In India with 6 Months Warranty. Designed for most 15.6"" Laptops and Ultrabooks",B07V47HHRG,AirCase
https://www.amazon.in/sspa/click?ie=UTF8&spc=MTo0Nzg1Mjc5NjA3NjcwNjYyOjE2NzcwODEzNDc6c3BfbXRmOjIwMDIxMTk5MDEwODA2OjowOjo&url=%2FCOSMUS-Polyester-Black-Laptop-Backpack%2Fdp%2FB01FU4B9JG%2Fref%3Dsr_1_43_sspa%3Fkeywords%3Dbags%26qid%3D1677081347%26sr%3D8-43-spons%26sp_csd%3Dd2lkZ2V0TmFtZT1zcF9tdGY%26psc%3D1,Cosmus Darwin 29 litres Office Backpack - Sleek Everyday use Backpack - Black,"₹1,159.00","9,859",160,2 Large Compartments + 2 Easy access front Pocket with organizersection & 2 mesh side pocket   Made in India. Outer Fabric: Durable PU coated water resistance Polyester Fabric.   Well cushioned Laptop compartment for upto 15.6 inch Laptop   Weight: 780gm; Dimensions: 14 x 18 x 7 inches (WxHxD); Warranty: 1 year Warranty against manufacturing defects.   Lining Description: Polyurethane; Water Resistance Level: Waterproof; Special Features: Bottle Holder; Age Range Description: Adult; Closure Type: Zipper; Pocket Description: Utility Pocket,B01FU4B9JG,Cosmus
https://www.amazon.in/sspa/click?ie=UTF8&spc=MTo0Nzg1Mjc5NjA3NjcwNjYyOjE2NzcwODEzNDc6c3BfbXRmOjIwMDIxNDI3OTc2NTA2OjowOjo&url=%2FKiller-Backpack-Compartments-Polyester-Waterproof%2Fdp%2FB07CDD6YS2%2Fref%3Dsr_1_44_sspa%3Fkeywords%3Dbags%26qid%3D1677081347%26sr%3D8-44-spons%26sp_csd%3Dd2lkZ2V0TmFtZT1zcF9tdGY%26psc%3D1,KILLER Louis 38L Large Laptop Backpack With 3 Compartments Polyester Trendy Waterproof Travel Backpack,"₹1,566.00","11,056",228,"Care Instructions: Hand Wash Only   3 Large Compartments, 1 Easy access front Pocket with organizer section & 2 mesh side pocket   Outer Fabric: Durable PU coated Polyester Fabric, inner abric: Strong PU coated polyester fabtic, Hip Strap : No   Well cushioned Laptop compartment for upto 15.6 inch Laptop and spacious enough to carry for two days cloths   Weight: 800gm; Dimensions: 13.00x18.75x9.50 inches (WxHxD)   Strap Type: Adjustable; Pattern Name: Solid; Closure Type: Zipper; Warranty Description: 1 Year Warranty Against Manufacturing Defects.; Pocket Description: Utility Pocket; Style Name: Casual; Compartment Description: Up To 15 Inches; Water Resistance Level: Waterproof; Age Range Description: Adult",B07CDD6YS2,"Ambrosia Bags, B-42, 2nd Floor, Ajay Mittal Industrial Estate Andheri Kurla Road, Marol, Andheri (E) Mumbai, Maharashtra, India – 400059 Mobile: +91 8767008844"
https://www.amazon.in/Lavie-Sport-Duffle-Luggage-Trolley/dp/B097RJ22Q3/ref=sr_1_45?keywords=bags&qid=1677081347&sr=8-45,Lavie Sport Lino Large Size 63 cms Wheel Duffle Bag for Travel | Travel Bag with Trolley,₹999.00,"5,970",34,"The Lino wheel Duffle Bag from Lavie Sport is a voluminous yet lightweight travel duffle. Made of high quality and durable materials, it provides the same function as a large-sized suitcase.Perfect travel duffle for weekend getaways.   Built to last: This duffle bag for travel features a combi-lock, shoulder strap, fully lined interior and is built with high-quality polyester fabric for the utmost durability. Made from water repellent & premium zippers, it makes it a super durable and lightweight all-weather travel duffle bag.   Plenty of Space & Easy to carry: The front side features a zippered pocket that is perfect to store quick access essentials. Lino luggage bags for travel have sturdy heavy-duty treaded rubber wheels in a protective wheel housing and retractable trolley for smooth mobility and maximum durability.   External Dimension: Length – 63cm, Width – 30cm, Height – 32cm, Capacity - 60 Litres.   Manufacturer warranty - 2 years",B097RJ22Q3,"Bagzone Lifestyle Pvt Ltd, Bagzone Lifestyle Pvt Ltd | | LAVIE 402, Ackruti Star, MIDC Central Road, Andheri East, Mumbai – 400093"
